Título;ISSN impresa;ISSN en linea;Instituto;CAICYT;DOAJ;Latindex;Redalyc;Scimago;Scielo;WoS;Biblat;Dialnet
Revista Argentina de Reumatología: Sociedad Argentina de Reumatología;2362-3675;;;true;true;true;true;true;true;true;true;true
Revista Asia América Latina;;2524-9347;EUDEBA;true;false;true;false;false;false;false;false;false
Revista Binacional Brasil - Argentina;;2316-1205;Universidade Estadual do Sudoeste da Bahia;false;true;false;false;false;false;false;false;false
Revista Blockchain e Inteligencia Artificial;2718-7535;;;true;true;true;true;true;true;true;true;true
Revista Científica Arbitrada de la Fundación MenteClara;;2469-0783;Fundación MenteClara;false;true;true;true;false;false;false;false;false
Revista Científica de UCES;;2591-5266;EDITUCES - Editorial de la Universidad de Ciencias Empresariales y Sociales (UCES);false;false;true;false;false;false;false;false;false
Revista Científica de la Facultad de Derecho y Ciencias Sociales y Políticas de la UNNE;2953-4232;;;true;true;true;true;true;true;true;true;true
Revista Científica y Técnica Agropecuaria, Agroindustrial y Ambiental.;;2796-9142;Facultad de Ciencias Agrarias Universidad Nacional de Lomas de Zamora;false;false;true;false;false;false;false;false;false
Revista Comunicación, Política y Seguridad.;;2683-7374;Instituto de Investigaciones Gino Germani;false;false;true;false;false;false;false;false;false
Revista Cosmovisiones/Cosmovisões;2684-0162;;;true;true;true;true;true;true;true;true;true
Revista Derecho del Trabajo;0325-3627;;;true;true;true;true;true;true;true;true;true
Revista Derecho y Salud;2591-3476;;;true;true;true;true;true;true;true;true;true
Revista Derechos en Acción;2525-1678;;;true;true;true;true;true;true;true;true;true
Revista Digital del Departamento de Ingeniería e Investigaciones Tecnológicas;;2525-1333;Departamento de Ingeniería e Investigaciones Tecnológicas de la Universidad Nacional de La Matanza;false;false;true;false;false;false;false;false;false
Revista Discusiones.;;2718-6474;EdiUns;true;true;true;false;false;false;false;false;false
Revista ES;2718-6539;;;true;true;true;true;true;true;true;true;true
Revista Electrónica de Derecho Internacional Contemporáneo: REDIC;2618-303X;;;true;true;true;true;true;true;true;true;true
Revista Electrónica de Didáctica en Educación Superior;;1853-3159;Universidad de Buenos Aires, Ciclo Básico Común, Biología para el Tercer Milenio;false;true;false;false;false;false;false;false;false
Revista Electrónica de divulgación de STEM de la Facultad de Ingeniería de la Universidad Nacional de la Patagonia San Juan Bosco.;;2683-8648;REDIUNP;true;false;true;false;false;false;false;false;false
Revista Electrónica del Instituto de Investigaciones Jurídicas y Sociales Ambrosio Lucas Gioja;1851-3069;;;true;true;true;true;true;true;true;true;true
Revista Escuela de Historia;1669-9041;;;true;true;true;true;true;true;true;true;true
Revista Estudios Sociales Contemporáneos;2451-5965;;;true;true;true;true;true;true;true;true;true
Revista Eurolatinoamericana de Derecho Administrativo;2362-583X;;;true;true;true;true;true;true;true;true;true
Revista Evaluar;1667-4545;;;true;true;true;true;true;true;true;true;true
Revista FAVE. Sección Ciencias veterinarias;;2362-5589;Universidad Nacional del Litoral;true;true;true;true;false;true;false;false;false
Revista Foro de Educación Musical, Artes y Pedagogía;2545-7101;2525-1317;Mutual Arte y Educación. Editorial Arte y Pedagogía;false;true;false;false;false;false;false;false;false
Revista Hematología;0329-0379;;;true;true;true;true;true;true;true;true;true
Revista Hormigón;;2718-9058;Asociación Argentina de Tecnología del Hormigón;false;false;true;false;false;false;false;false;false
Revista IRICE (En línea);;2618-4052;;true;true;true;false;false;false;false;false;false
Revista ISEL;2344-9403;;;true;true;true;true;true;true;true;true;true
Revista Iberoamericana de Derecho, Cultura y Ambiente;2953-3554;;;true;true;true;true;true;true;true;true;true
Revista Iberoamericana de Justicia Terapéutica;2718-6822;;;true;true;true;true;true;true;true;true;true
Revista Integración Regional & Derechos Humanos;2346-9196;;;true;true;true;true;true;true;true;true;true
Revista Interdisciplinaria de Estudios Agrarios;2618-2475;;;true;true;true;true;true;true;true;true;true
Revista Internacional de Derechos Humanos;2422-7188;;;true;true;true;true;true;true;true;true;true
Revista Irice;0327-392X;;;true;true;true;true;true;true;true;true;true
Revista Jurídica Austral;2684-057X;;;true;true;true;true;true;true;true;true;true
Revista Jurídica Austral;2684-0537;;;true;true;true;true;true;true;true;true;true
Revista Latinoamericana de Antropología del Trabajo;2591-2755;;;true;true;true;true;true;true;true;true;true
Revista Latinoamericana de Educación Comparada: RELEC;1853-3744;;;true;true;true;true;true;true;true;true;true
Revista Latinoamericana de Estudios del Discurso;2447-9543;;;true;true;true;true;true;true;true;true;true
Revista Latinoamericana de Estudios sobre Cuerpos, Emociones y Sociedad ( RELACES );1852-8759;;;true;true;true;true;true;true;true;true;true
Revista Latinoamericana de Metodología de la Investigación Social: ReLMIS;1853-6190;;;true;true;true;true;true;true;true;true;true
Revista Latinoamericana de Metodología de las Ciencias Sociales: Relmecs;1853-7863;;;true;true;true;true;true;true;true;true;true
Revista Latinoamericana de la Papa;1853-4961;;;true;true;true;true;true;true;true;true;true
Revista Lecciones y Ensayos;0024-0079;2362-4620;Universidad de Buenos Aires, Facultad de Derecho;false;true;false;false;false;false;false;false;false
Revista Ludicamente;2250-723X;;;true;true;true;true;true;true;true;true;true
Revista Methodo: Investigación Aplicada a las Ciencias Biológicas;2545-8302;;;true;true;true;true;true;true;true;true;true
Revista Médica de Rosario;0327-5019;1851-2135;Círculo Médico de Rosario;false;true;false;false;false;false;true;false;false
Revista Pares;2718-8582;;;true;true;true;true;true;true;true;true;true
Revista Perspectivas Metodológicas;2618-4125;;;true;true;true;true;true;true;true;true;true
Revista Perspectivas de Políticas Públicas;1853-9254;;;true;true;true;true;true;true;true;true;true
Revista Política Austral;2953-4321;;;true;true;true;true;true;true;true;true;true
Revista Prefacio: escuela de bibliotecología;2591-3905;;;true;true;true;true;true;true;true;true;true
Revista Quebracho;0328-0543;1851-3026;Universidad Nacional de Santiago del Estero, Facultad de Ciencias Forestales;true;true;false;true;false;false;true;false;false
Revista Rey Desnudo: Revista de Libros;2314-1204;;;true;true;true;true;true;true;true;true;true
Revista SAAP: Sociedad Argentina de Análisis Político;1853-1970;;;true;true;true;true;true;true;true;true;true
Revista Teología.;;2683-7307;Ediciones Facultad de Teología;true;true;true;false;false;false;false;false;false
Revista UCES D.G. "Enseñanza y aprendizaje del diseño;;2344-9551;Editorial de la Universidad de Ciencias Empresariales y Sociales;false;true;true;false;false;false;false;false;false
Revista Unidad Sanitaria XXI;2718-8388;;;true;true;true;true;true;true;true;true;true
Revista Veterinaria;1669-6840;1668-4834;Universidad Nacional del Nordeste;true;false;false;false;true;false;true;false;false
Revista administración pública y sociedad (En línea);;2524-9568;;true;true;true;false;false;false;false;false;false
Revista agronómica del noroeste argentino;0080-2069;2314-369X;;true;false;false;false;false;false;false;false;false
Revista americana de medicina respiratoria;;1852-236X;Asociación Argentina de Medicina Respiratoria;true;false;false;true;false;true;false;false;false
Revista archivos de medicina familiar y general;;1852-656X;Federación Argentina de Medicina Familiar y General;false;false;true;false;false;false;false;false;false
Revista argentina de anatomía clínica;;1852-8023;;true;true;false;false;false;false;false;false;false
Revista argentina de antropología biológica;;1514-7991;Asociación de Antropología Biológica Argentina;true;true;true;true;false;true;false;false;false
Revista argentina de ciencia política (Buenos Aires);0329-3092;2683-9032;;true;false;true;false;false;false;false;false;false
Revista argentina de ciencias del comportamiento;1852-4206;;;true;true;true;true;true;true;true;true;true
Revista argentina de cirugía;2250-639X;;;true;true;true;true;true;true;true;true;true
Revista argentina de clínica psicológica;0327-6716;;;true;true;true;true;true;true;true;true;true
Revista argentina de coloproctología;;2683-7846;Sociedad Argentina de Coloproctologia;true;false;true;false;false;false;false;false;false
Revista argentina de derecho de la energía, hidrocarburos y minería.;;2362-3195;Editorial Abaco de Rodolfo Depalma S.R.L;false;false;true;false;false;false;false;false;false
Revista argentina de dermatología;;1851-300X;Asociación Argentina de Dermatología;true;true;true;false;false;true;false;false;false
Revista argentina de endocrinología y metabolismo (1983);0326-4610;1851-3034;;true;false;false;false;false;false;false;false;false
Revista argentina de lingüística;0326-6400;;;true;true;true;true;true;true;true;true;true
Revista argentina de medicina (En línea);;2618-4311;Sociedad Argentina de Medicina;true;false;true;false;false;false;false;false;false
Revista argentina de microbiología;0325-7541;;;true;true;true;true;true;true;true;true;true
Revista argentina de producción animal;0326-0550;2314-324X;;true;false;false;false;false;false;false;false;false
Revista argentina de salud pública;1853-810X;;;true;true;true;true;true;true;true;true;true
Revista argentina de sociología;1667-9261;;;true;true;true;true;true;true;true;true;true
Revista argentina de sociología;1669-3248;;;true;true;true;true;true;true;true;true;true
Revista argentina de terapia intensiva;;2591-3387;Sociedad Argentina de Terapia Intensiva;false;true;true;false;false;false;false;false;false
Revista argentina de tuberculosis, enfermedades pulmonares y salud pública;0325-9307;;;true;true;true;true;true;true;true;true;true
Revista argentina de urología y nefrología;0048-7627;;;true;true;true;true;true;true;true;true;true
Revista argentina del tórax;0327-1595;;;true;true;true;true;true;true;true;true;true
Revista astronómica;0044-9253;;;true;true;true;true;true;true;true;true;true
Revista bíblica;0034-7078;;;true;true;true;true;true;true;true;true;true
Revista bíblica.;;2683-7153;Editorial Verbo Divino;true;false;true;false;false;false;true;false;false
Revista científica;;2525-0396;Secretaría de Planeamiento, Facultad de Ingeniería, Universidad Nacional de Lomas de Zamora;false;true;true;false;false;false;false;false;false
Revista científica de sistemas e informática;2709-992X;;;true;true;true;true;true;true;true;true;true
Revista conexiones.;;2591-3344;Universidad de la Cuenca del Plata;false;false;true;false;false;false;false;false;false
Revista de Ciencia y Tecnología: RECyT;1851-7587;;;true;true;true;true;true;true;true;true;true
Revista de Culturas y Literaturas Comparadas;;2591-3883;Facultad de Lenguas. Universidad Nacional de Córdoba;false;true;true;false;false;false;false;false;false
Revista de Derecho Romano;2683-7463;;;true;true;true;true;true;true;true;true;true
Revista de Derecho Romano;2618-5148;;;true;true;true;true;true;true;true;true;true
Revista de Derecho de las Minorías;2683-8877;;;true;true;true;true;true;true;true;true;true
Revista de Educación Matemática (RevEM);1852-2890;;;true;true;true;true;true;true;true;true;true
Revista de Estudios Marítimos y Sociales;1852-0669;;;true;true;true;true;true;true;true;true;true
Revista de Estudios sobre Genocidio;1851-8184;2362-3985;Universidad Nacional de Tres de Febrero, Centro de Estudios sobre Genocidio;false;true;false;false;false;false;false;false;false
Revista de Filosofía (La Plata);2953-3392;;;true;true;true;true;true;true;true;true;true
Revista de Filosofía Jurídica y Social;2314-128X;;;true;true;true;true;true;true;true;true;true
Revista de Geología Aplicada a la Ingeniería y al Ambiente;2422-5703;;;true;true;true;true;true;true;true;true;true
Revista de Interés Público (ReDIP);2545-8604;;;true;true;true;true;true;true;true;true;true
Revista de Investigaciones Agropecuarias;0325-8718;;;true;true;true;true;true;true;true;true;true
Revista de Investigaciones en Técnica Vocal;2347-0275;;;true;true;true;true;true;true;true;true;true
Revista de Medicina Veterinaria;;1852-771X;Sociedad de Medicina Veterinaria;false;false;true;false;false;false;false;false;false
Revista de Nefrología, Diálisis y Trasplante;2346-8548;;;true;true;true;true;true;true;true;true;true
Revista de antropología del Museo de Entre Ríos;2347-033X;;;true;true;true;true;true;true;true;true;true
Revista de arqueología histórica argentina y latinoamericana.;1851-3190;2344-9918;Asociación de Arqueólogos Profesionales de la República Argentina;true;true;true;true;false;false;true;false;false
Revista de ciencia y tecnología. Serie forestal;1668-4133;;;true;true;true;true;true;true;true;true;true
Revista de ciencias administrativas - INADE;0325-3791;;;true;true;true;true;true;true;true;true;true
Revista de ciencias empresariales;2468-9785;2468-9807;Cordoba Management School, Escuela de Negocios de la Universidad Blas Pascal;false;true;true;false;false;false;false;false;false
Revista de ciencias jurídicas y sociales;0325-0601;;;true;true;true;true;true;true;true;true;true
Revista de ciencias sociales - Universidad Nacional de Quilmes;0328-2643;;;true;true;true;true;true;true;true;true;true
Revista de derecho Penal y Criminología;0034-7914;;;true;true;true;true;true;true;true;true;true
Revista de derecho de familia y de las personas;1852-8708;;;true;true;true;true;true;true;true;true;true
Revista de derecho internacional y ciencias diplomáticas;0034-7892;;;true;true;true;true;true;true;true;true;true
Revista de derecho procesal;1850-9290;;;true;true;true;true;true;true;true;true;true
Revista de economía política de Buenos Aires;1850-6933;1853-1350;Universidad de Buenos Aires. Facultad de Ciencias Económicas;true;true;true;false;false;false;false;false;false
Revista de economía y estadística;0034-8066;;;true;true;true;true;true;true;true;true;true
Revista de educación;1853-1318;1853-1326;Editorial de la Universidad Nacional de Mar del Plata;true;true;true;false;false;false;false;false;false
Revista de educación en biología;0329-5192;;;true;true;true;true;true;true;true;true;true
Revista de educación en biología (En línea);;2344-9225;Asociación de Docentes en Ciencias Biológicas de la Argentina;true;true;true;false;false;false;false;false;false
Revista de educación y cultura;0325-2736;;;true;true;true;true;true;true;true;true;true
Revista de enseñanza de la física;0326-7091;;;true;true;true;true;true;true;true;true;true
Revista de enseñanza de la física;2250-6101;;;true;true;true;true;true;true;true;true;true
Revista de estudios clásicos;;2469-0643;Instituto de Lenguas y Literaturas Clásicas, Facultad de Filosofía y Letras, Universidad Nacional de Cuyo;true;true;true;false;false;false;false;false;false
Revista de estudios clásicos;0325-3465;;;true;true;true;true;true;true;true;true;true
Revista de estudios marítimos y sociales;2545-6237;;;true;true;true;true;true;true;true;true;true
Revista de estudios procesales;0326-9981;;;true;true;true;true;true;true;true;true;true
Revista de estudios regionales y mercado de trabajo;1669-9084;;;true;true;true;true;true;true;true;true;true
Revista de filosofía y teoría política;0328-6223;;;true;true;true;true;true;true;true;true;true
Revista de geografía (San Juan);1514-1942;2618-2084;;true;false;true;false;false;false;false;false;false
Revista de historia & humanidades médicas;1850-0064;;;true;true;true;true;true;true;true;true;true
Revista de historia americana y argentina;2314-1549;;;true;true;true;true;true;true;true;true;true
Revista de historia de las prisiones;;2451-6473;Universidad Nacional de Tucumán;true;false;true;false;false;false;false;false;false
Revista de historia del derecho;1853-1784;;;true;true;true;true;true;true;true;true;true
Revista de historia del derecho;0325-1918;;;true;true;true;true;true;true;true;true;true
Revista de historia universal.;;2683-8869;Universidad Nacional de Cuyo, Facultad de Filosofía y Letras;false;false;true;false;false;false;false;false;false
Revista de ictiología;0327-6090;;;true;true;true;true;true;true;true;true;true
Revista de ingeniería (La Plata);0482-5772;;;true;true;true;true;true;true;true;true;true
Revista de investigación en modelos financieros;2250-687X;2250-6861;Centro de Investigación en Métodos Cuantitativos Aplicados a la Economía y la Gestión, Facultad de Ciencias Económicas, Universidad de Buenos Aires;false;false;true;false;false;false;false;false;false
Revista de investigación y desarrollo pesquero;0325-6375;;;true;true;true;true;true;true;true;true;true
Revista de investigación y disciplinas.;;2683-9040;Centro de Informática Educativa;false;false;true;false;false;false;false;false;false
Revista de la Asociación Argentina de Ortopedia y Traumatología;1852-7434;;;true;true;true;true;true;true;true;true;true
Revista de la Asociación Geológica Argentina;0004-4822;1851-8249;;true;false;false;false;false;false;true;false;false
Revista de la Asociación Odontológica Argentina;2683-7226;;;true;true;true;true;true;true;true;true;true
Revista de la Asociación de Ciencias Naturales del Litoral;0325-2809;;;true;true;true;true;true;true;true;true;true
Revista de la Carrera de Sociología Entramados y Perspectivas;1853-6484;;;true;true;true;true;true;true;true;true;true
Revista de la Escuela de Antropología.;;2618-2998;FHUMYAR Ediciones;true;true;true;false;false;false;false;false;false
Revista de la Escuela de Ciencias de la Educación;1851-6297;2362-3349;Universidad Nacional de Rosario;true;true;true;true;false;false;false;false;false
Revista de la Escuela de Economía y Negocios;1514-2779;;;true;true;true;true;true;true;true;true;true
Revista de la Escuela de Perfeccionamiento en Investigación Operativa;0329-7322;1853-9777;Universidad Nacional del Centro de la Provincia de Buenos Aires. Facultad de Ciencias Económicas. Escuela de Perfeccionamiento en Investigación Operativa.;false;false;true;false;false;false;false;false;false
Revista de la Facultad;1850-9371;2314-3061;;true;false;false;false;false;false;false;false;false
Revista de la Facultad de Agronomía;1669-9513;;;true;true;true;true;true;true;true;true;true
Revista de la Facultad de Ciencias Agrarias;0370-4661;;Universidad Nacional de Cuyo;true;true;true;true;true;true;true;true;true
Revista de la Facultad de Ciencias Agrarias. Universidad Nacional de Cuyo;;1853-8665;Revista de la Facultad de Ciencias Agrarias. Universidad Nacional de Cuyo;true;true;true;true;false;true;true;false;false
Revista de la Facultad de Ciencias Económicas (En línea);;1668-6365;Universidad Nacional del Nordeste;true;true;true;false;false;false;false;false;false
Revista de la Facultad de Ciencias Económicas (Mendoza);0041-8668;;;true;true;true;true;true;true;true;true;true
Revista de la Facultad de Ciencias Económicas: (UNNE);1668-6357;;;true;true;true;true;true;true;true;true;true
Revista de la Facultad de Ciencias Médicas de Córdoba;0014-6722;;;true;true;true;true;true;true;true;true;true
Revista de la Facultad de Odontología ( Universidad de Buenos Aires );0326-632X;;;true;true;true;true;true;true;true;true;true
Revista de la Facultad de Odontología - Universidad Nacional de Córdoba;0325-1071;;;true;true;true;true;true;true;true;true;true
Revista de la Facultad de Odontología.;;2683-7986;Universidad Nacional del Nordeste, Facultad de Odontología (FOUNE);false;false;true;false;false;false;false;false;false
Revista de la Facultad de Odontología.;;2545-7594;Universidad Nacional de Córdoba;false;false;true;false;false;false;false;false;false
Revista de la Facultad de Odontología. Universidad de Buenos Aires.;;1668-8538;Universidad de Buenos Aires. Facultad de Odontología;true;false;true;false;false;false;false;false;false
Revista de la Facultad de Odontología: (UNNE);1668-7280;;;true;true;true;true;true;true;true;true;true
Revista de la Federación Argentina de Cardiología;0326-646X;;;true;true;true;true;true;true;true;true;true
Revista de la Red Intercátedras de Historia de América Latina Contemporánea: Segunda Época;2250-7264;;;true;true;true;true;true;true;true;true;true
Revista de la Sociedad Argentina de Biología;0037-8380;;;true;true;true;true;true;true;true;true;true
Revista de la Sociedad Argentina de Diabetes;2346-9420;;;true;true;true;true;true;true;true;true;true
Revista de la Sociedad Argentina de Diabetes;0325-5247;;;true;true;true;true;true;true;true;true;true
Revista de la Sociedad Entomológica Argentina;0373-5680;1851-7471;Sociedad Entomológica Argentina;true;true;false;true;true;true;true;false;false
Revista de la Sociedad de Obstetricia y Ginecología de Buenos Aires;0037-8542;;;true;true;true;true;true;true;true;true;true
Revista de la Universidad Nacional del Centro de la Provincia de Buenos Aires;0325-4860;;;true;true;true;true;true;true;true;true;true
Revista de la Unión Matemática Argentina;0041-6932;;;true;true;true;true;true;true;true;true;true
Revista de la Unión Matemática Argentina;1669-9637;;;true;true;true;true;true;true;true;true;true
Revista de lengua y literatura;;2408-4646;Universidad Nacional del Comahue, Facultad de Humanidades, Departamento de Letras;false;false;true;false;false;false;false;false;false
Revista de literaturas modernas.;;2683-8389;Instituto de Literaturas Modernas, Facultad de Filosofía y Letras, Universidad Nacional de Cuyo;false;false;true;false;false;false;false;false;false
Revista de nefrología, diálisis y transplante;0326-3428;;;true;true;true;true;true;true;true;true;true
Revista de oxigenoterapia hiperbárica;0326-6761;;;true;true;true;true;true;true;true;true;true
Revista de psicoanálisis;0034-8740;;;true;true;true;true;true;true;true;true;true
Revista de psicología;2422-572X;;;true;true;true;true;true;true;true;true;true
Revista de psicología.;;2469-2050;Departamento de Psicología, Facultad de Psicología y Psicopedagogía, Pontificia Universidad Católica Argentina;true;true;true;false;false;false;false;false;false
Revista de responsabilidad civil y seguros: publicación mensual de doctrina, jurisprudencia y legislación;1666-4590;;;true;true;true;true;true;true;true;true;true
Revista de salud pública (Córdoba);1852-9429;;;true;true;true;true;true;true;true;true;true
Revista de seguridad social;0325-4852;;;true;true;true;true;true;true;true;true;true
Revista debate público;;1853-6654;Universidad de Buenos Aires, Facultad de Ciencias Sociales, Carrera de Trabajo Social;false;false;true;false;false;false;false;false;false
Revista del CEI. Comercio Exterior e Integración;1850-1737;;;true;true;true;true;true;true;true;true;true
Revista del Centro de Estudios de Sociología del Trabajo;1852-4648;;;true;true;true;true;true;true;true;true;true
Revista del Cisen Tramas/Maepova;2344-9594;;;true;true;true;true;true;true;true;true;true
Revista del Círculo Odontológico de Rosario;0009-7357;;;true;true;true;true;true;true;true;true;true
Revista del Hospital Italiano de Buenos Aires;;2314-3312;;false;true;false;false;false;false;false;false;false
Revista del Hospital Materno Infantil Ramón Sardá;;1514-9838;Hospital Materno Infantil Ramón Sardá;false;false;false;true;false;false;false;false;false
Revista del Hospital de Niños;0521-517X;2314-1239;Hospital de Niños Ricardo Gutiérrez;false;true;false;false;false;false;false;false;false
Revista del IICE (Ciudad Autónoma de Buenos Aires, En línea);;2451-5434;Facultad de Filosofía y Letras Universidad de Buenos Aires;true;true;true;false;false;false;false;false;false
Revista del Instituto Internacional de Costos;2718-8507;;;true;true;true;true;true;true;true;true;true
Revista del Instituto Superior de Música: Revista del Instituto Superior de Música de la Universidad Nacional de Litoral;2362-3322;;;true;true;true;true;true;true;true;true;true
Revista del Instituto de Historia Antigua Oriental "Dr. Abraham Rosenvasser".;;2683-9660;Universidad de Buenos Aires, Facultad de Filosofía y Letras;false;false;true;false;false;false;false;false;false
Revista del Instituto de Investigaciones en Ciencias de la Educación;0327-7763;;;true;true;true;true;true;true;true;true;true
Revista del Instituto de Investigaciones en Educación;1853-1393;;;true;true;true;true;true;true;true;true;true
Revista del Instituto de Investigación Musicológica Carlos Vega: Publicación de la facultad de Artes y Ciencias Musicales de la Universidad Católica Argentina;1515-050X;;;true;true;true;true;true;true;true;true;true
Revista del Museo Argentino de Ciencias Naturales;1853-0400;;;true;true;true;true;true;true;true;true;true
Revista del Museo Argentino de Ciencias Naturales "Bernardino Rivadavia". Botánica;0376-2793;;;true;true;true;true;true;true;true;true;true
Revista del Museo Argentino de Ciencias Naturales "Bernardino Rivadavia". Ecología;0524-9481;;;true;true;true;true;true;true;true;true;true
Revista del Museo Argentino de Ciencias Naturales "Bernardino Rivadavia". Entomología;0524-949X;;;true;true;true;true;true;true;true;true;true
Revista del Museo Argentino de Ciencias Naturales "Bernardino Rivadavia". Geología;0027-3880;;;true;true;true;true;true;true;true;true;true
Revista del Museo Argentino de Ciencias Naturales "Bernardino Rivadavia". Hidrobiología;0524-9503;;;true;true;true;true;true;true;true;true;true
Revista del Museo Argentino de Ciencias Naturales "Bernardino Rivadavia". Paleontología;0524-9511;;;true;true;true;true;true;true;true;true;true
Revista del Museo Argentino de Ciencias Naturales "Bernardino Rivadavia". Zoología;0373-9066;;;true;true;true;true;true;true;true;true;true
