Título;ISSN impresa;ISSN en linea;Instituto;CAICYT;DOAJ;Latindex;Redalyc;Scimago;Scielo;WoS
Toma uno;2313-9692;2250-4524;Universidad Nacional de Córdoba. Facultad de Artes. Departamento de Cine y TV;true;false;true;false
Trabajo y sociedad (Santiago del Estero);null;1514-6871;null;true;true;true;true
Trabajos y comunicaciones – Departamento de Historia (La Plata);0325-173X;2346-8971;null;true;true;true;false
Tram[p]as;null;2314-274X;Universidad Nacional de La Plata, Facultad de Periodismo y Comunicación Social;false;false;true;false
Travesía (San Miguel de Tucumán);0329-9449;2314-2707;null;true;false;false;false
Tábano (En línea);null;2591-572X;Universidad Católica Argentina;true;true;true;false
Tópicos;1666-485X;1668-723X;Asociación Revista de Filosofía de Santa Fe;false;true;true;true
Tópicos (Santa Fe);1666-485X;1666-723X;null;true;false;false;false
Unidad sociológica;null;2362-1850;F. L. Abiuso;false;false;true;false
Urbania;null;2591-5681;Arqueocoop Ltda;false;true;true;false
Vertex Revista Argentina de Psiquiatría.;null;2718-904X;Editorial Polemos;true;false;true;false
Virtualidad, educación y ciencia;null;1853-6530;Maestría en Procesos Educativos Mediados por Tecnología, Centro de Estudios Avanzados, Universidad Nacional de Córdoba;false;true;true;false
Visión de futuro;1668-8708;1669-7634;Facultad de Ciencias Económicas, Universidad Nacional de Misiones;true;true;true;true
Vivienda y Ciudad;null;2422-670X;Universidad Nacional de Córdoba, Facultad de Arquitectura, Urbanismo y Diseño, Instituto de Investigación de Vivienda y Hábitat;false;true;false;false
Vivomatografías;null;2469-0767;Vivomatografías. Revista de estudios sobre precine y cine silente en Latinoamérica;false;true;true;false
Zama.;null;2422-6017;Instituto de Literatura Hispanoamericana, Facultad de Filosofía y Letras, Universidad de Buenos Aires.;false;false;true;false
Zaranda de Ideas;2408-3801;1853-1296;Asociacion de Arqueologos Profesionales de la Republica Argentina;true;true;true;false
Zona franca (Rosario, En línea);null;2545-6504;Facultad de Humanidades y Artes, Universidad Nacional de Rosario;true;true;true;false
Ágora UNLaR;null;2545-6024;Universidad Nacional de La Rioja;false;false;true;false
Área.;null;2591-5312;Secretaría de Investigaciones, Facultad de Arquitectura, Diseño y Urbanismo, Universidad de Buenos Aires;true;true;true;false
Ética y Cine Journal;2250-5415;2250-5660;Universidad de Buenos Aires;true;true;true;true
Ética y discurso.;null;2525-1090;Qellqasqa Editorial;false;false;true;false
Ñeatá.;null;2718-7268;Universidad Nacional del Nordeste;false;true;true;false
