Título;ISSN impresa;ISSN en linea;Instituto;CAICYT;DOAJ;Latindex;Redalyc;Scimago;Scielo;WoS;Biblat;Dialnet
Integración & comercio;1026-0463;;;true;true;true;true;true;true;true;true;true
Integración latinoamericana;0325-1675;;;true;true;true;true;true;true;true;true;true
Integración y Conocimiento: Revista del Núcleo de Estudios e Investigaciones en Educación Superior de Mercosur;2347-0658;;;true;true;true;true;true;true;true;true;true
Inter litteras;;2683-9695;Facultad de Filosofía y Letras, Universidad de Buenos Aires;false;false;true;false;false;false;false;false;false
Interdisciplinaria: Revista de psicología y ciencias afines = journal of psychology and related sciences;1668-7027;;;true;true;true;true;true;true;true;true;true
Interdisciplinary Rehabilitation / Rehabilitación Interdisciplinaria;;2953-5069;Editorial Salud, Ciencia y Tecnología;false;false;true;false;false;false;false;false;false
Intersecciones en comunicación;2250-4184;;;true;true;true;true;true;true;true;true;true
Intersticios;;2250-6543;Universidad Nacional de Córdoba. Facultad de Filosofía y Humanidades. Cátedra de Filosofía Argentina y Latinoamericana.;false;true;true;false;false;false;false;false;false
Invenio: Revista de investigación académica;0329-3475;;;true;true;true;true;true;true;true;true;true
Investiga +: publicación de la Dirección de Posgrado e Investigación de la Universidad Provincial de Córdoba;2618-4370;;;true;true;true;true;true;true;true;true;true
Investigaciones y Ensayos;0539-242X;;;true;true;true;true;true;true;true;true;true
Investigaciones y ensayos.;;2545-7055;Academia Nacional de la Historia;false;true;true;false;false;false;false;false;false
Investigaciones: Secretaría de Investigación de Derecho Comparado;1666-3241;;;true;true;true;true;true;true;true;true;true
Investigación Joven;2314-3991;;;true;true;true;true;true;true;true;true;true
Investigación, ciencia y universidad.;;2525-1783;Editorial UMaza (Editorial de la universidad Juan Agustín Maza);false;false;true;false;false;false;false;false;false
Investigando en Psicología.;;2796-9002;Facultad de Psicología. Universidad Nacional de Tucumán.;false;false;true;false;false;false;false;false;false
Itinerantes: Revista de Historia y Religión;2525-2178;;;true;true;true;true;true;true;true;true;true
Itinerarios Educativos;1850-3853;;;true;true;true;true;true;true;true;true;true
Itinerarios educativos (En línea);;2362-5554;Universidad Nacional del Litoral;true;true;true;false;false;false;false;false;false
Ixtli;;2408-4751;;true;true;false;false;false;false;false;false;false
Journal de Ciencias Sociales;2362-194X;;;true;true;true;true;true;true;true;true;true
Journal of Computer Science and Technology;1666-6038;;;true;true;true;true;true;true;true;true;true
Journal of applied economics;1667-6726;;;true;true;true;true;true;true;true;true;true
Kairos: Revista de temas sociales;1514-9331;;;true;true;true;true;true;true;true;true;true
Kimún (San Luis);2469-066X;;;true;true;true;true;true;true;true;true;true
Konvergencias: Revista de Filosofía y Culturas en Diálogo;1669-9092;;;true;true;true;true;true;true;true;true;true
Kurtziana (Córdoba);0075-7314;;;true;true;true;true;true;true;true;true;true
La Aljaba: Segunda Época, Revista de Estudios de la Mujer;1669-5704;;;true;true;true;true;true;true;true;true;true
La Zaranda de Ideas: Revista de Jóvenes Investigadores en Arqueología;1853-1296;;;true;true;true;true;true;true;true;true;true
La alimentación latinoamericana;0325-3384;;;true;true;true;true;true;true;true;true;true
La gaceta universitaria: órgano de publicación de la cátedra de Literatura Argentina;1851-359X;;;true;true;true;true;true;true;true;true;true
La prensa médica argentina;0032-745X;;;true;true;true;true;true;true;true;true;true
La rivada;;2347-1085;Secretaría de Investigación y Posgrado. Facultad de Humanidades y Ciencias Sociales. Universidad Nacional de Misiones.;false;false;true;false;false;false;false;false;false
La trama de la comunicación;1668-5628;;;true;true;true;true;true;true;true;true;true
La técnica del frío;0040-1730;;;true;true;true;true;true;true;true;true;true
Latin American applied research;0327-0793;;;true;true;true;true;true;true;true;true;true
Latin American journal of pharmacy;0326-2383;2362-3853;;true;false;false;false;false;false;true;false;false
Latin american journal of sedimentology and basin analysis;1669-7316;1851-4979;Asociación Argentina de Sedimentología;true;true;true;true;true;true;false;false;false
Latitud sur.;1850-3659;2683-9326;Universidad de Buenos Aires, Facultad de Ciencias Económicas, Centro de Investigación en Estudios Latinoamericanos para el Desarrollo y la Integración;false;false;true;false;false;false;false;false;false
Lavboratorio: revista de estudios sobre cambio estructural y desigualdad social;1852-4435;;;true;true;true;true;true;true;true;true;true
Lectura y vida: Revista latinoamericana de lectura;0325-8637;;;true;true;true;true;true;true;true;true;true
Lecturas: Educación física y deportes;1514-3465;;;true;true;true;true;true;true;true;true;true
Letra. Imagen. Sonido: Ciudad Mediatizada;1851-8931;;;true;true;true;true;true;true;true;true;true
Letras.;;2683-7897;Facultad de Filosofía y Letras - UCA;false;false;true;false;false;false;false;false;false
Letras: revista de la Facultad de Filosofía y Letras de la Pontificia Universidad Católica Argentina Santa María de los Buenos Aires;0326-3363;;;true;true;true;true;true;true;true;true;true
Lilloa;0075-9481;;;true;true;true;true;true;true;true;true;true
Limen;0024-354X;;;true;true;true;true;true;true;true;true;true
Limnobios;0325-7592;;;true;true;true;true;true;true;true;true;true
Litorales: Teoría, método y técnica en geografía y otras ciencias sociales;1666-5945;;;true;true;true;true;true;true;true;true;true
Locale;2683-8796;;;true;true;true;true;true;true;true;true;true
Lorentzia;0076-0897;;;true;true;true;true;true;true;true;true;true
Luthor;1853-3272;;;true;true;true;true;true;true;true;true;true
MULTEQUINA;1852-7329;;MULTEQUINA-LATIN AMER JOURNAL NATURAL RESOURCES , IADIZA CC 507, MENDOZA, ARGENTINA, 5500;true;true;true;true;true;true;true;true;true
Magallánica. Revista de historia moderna;2422-779X;;;true;true;true;true;true;true;true;true;true
Malvinas en Cuestión: Revista electrónica interdisciplinaria sobre la cuestión Malvinas, Antártida y Atlántico Sur;2953-3430;;;true;true;true;true;true;true;true;true;true
Margen: revista de trabajo social y ciencias sociales;0327-7585;;;true;true;true;true;true;true;true;true;true
Marine and fishery sciences;2683-7951;;;true;true;true;true;true;true;true;true;true
Masquedós: Revista de Extensión Universitaria;2469-2158;;;true;true;true;true;true;true;true;true;true
Mastozoología neotropical;1666-0536;;;true;true;true;true;true;true;true;true;true
Mathematicae notae;0025-553X;;;true;true;true;true;true;true;true;true;true
Medicina (Buenos Aires);0025-7680;;;true;true;true;true;true;true;true;true;true
Medicina y sociedad;0325-9552;;;true;true;true;true;true;true;true;true;true
Medio ambiente y urbanización;0326-7857;;;true;true;true;true;true;true;true;true;true
Memoria Americana. Cuadernos de etnohistoria;1851-3751;;;true;true;true;true;true;true;true;true;true
Mendeliana;0325-223X;;;true;true;true;true;true;true;true;true;true
Metal: Memorias, escritos y trabajos desde América Latina;2451-6643;;;true;true;true;true;true;true;true;true;true
Metatheoria;1853-2330;;;true;true;true;true;true;true;true;true;true
Metaverse Basic and Applied Research;;2953-4577;Editorial Salud, Ciencia y Tecnología;false;false;true;false;false;false;false;false;false
Meteorologica;1850-468X;;;true;true;true;true;true;true;true;true;true
Millcayac: Revista Digital de Ciencias Sociales;2362-616X;;;true;true;true;true;true;true;true;true;true
Miradas en Movimiento;1852-2173;;;true;true;true;true;true;true;true;true;true
Miríada. Investigación en ciencias sociales;2250-4621;;;true;true;true;true;true;true;true;true;true
Miríada: Investigación en Ciencias Sociales;1851-9431;;;true;true;true;true;true;true;true;true;true
Miscelánea - Academia Nacional de Ciencias;0325-3406;;;true;true;true;true;true;true;true;true;true
Mitológicas (Buenos Aires);0326-5676;;;true;true;true;true;true;true;true;true;true
Momba'etéva: Revista de Investigaciones en Ciencias Jurídicas, Sociales y Políticas;2718-7144;;;true;true;true;true;true;true;true;true;true
Monografías del Museo Argentino de Ciencias Naturales "Bernardino Rivadavia";1515-7652;;;true;true;true;true;true;true;true;true;true
Mora;1853-001X;;;true;true;true;true;true;true;true;true;true
Multequina (Mendoza);0327-9375;;;true;true;true;true;true;true;true;true;true
Mundo agrario (La Plata);1515-5994;;;true;true;true;true;true;true;true;true;true
Mundo de antes;1514-982X;2362-325X;Universidad Nacional de Tucumán. Facultad de Ciencias Naturales e Instituto Miguel Lillo. Instituto de Arqueología y Museo;true;true;true;false;false;false;false;false;false
NOTULAS FAUNISTICAS;0327-0017;;NOTULAS FAUNISTICAS , C/O JULIO RAFAEL CONTRERAS, EDITOR, CASILLA DE CORREO 26, CORRIENTES, ARGENTINA, 3400;true;true;true;true;true;true;true;true;true
NUEVO PENSAMIENTO-REVISTA DE FILOSOFIA;1853-7596;;UNIV SALVADOR, FAC FILOSOFIA & LETRAS , LAVALLE, BUENOS AIRES, ARGENTINA, 00000;true;true;true;true;true;true;true;true;true
Natura neotropicalis;0329-2177;;;true;true;true;true;true;true;true;true;true
Nimio;2469-1879;;;true;true;true;true;true;true;true;true;true
Nota al margen;3008-7015;;;true;true;true;true;true;true;true;true;true
Notas de matemática discreta;0326-1336;;;true;true;true;true;true;true;true;true;true
Notas de álgebra y análisis;0078-2009;;;true;true;true;true;true;true;true;true;true
Notas del Museo de La Plata. Serie botánica;0372-4557;;;true;true;true;true;true;true;true;true;true
Notas del Museo de La Plata. Serie geología;0372-4530;;;true;true;true;true;true;true;true;true;true
Notas del Museo de La Plata. Serie paleontología;0325-2256;;;true;true;true;true;true;true;true;true;true
Notas del Museo de La Plata. Serie zoología;0372-4549;;;true;true;true;true;true;true;true;true;true
Novedades económicas;0325-8114;;;true;true;true;true;true;true;true;true;true
Nuestra historia;0029-571X;;;true;true;true;true;true;true;true;true;true
Nuestras Aves;0326-7725;;;true;true;true;true;true;true;true;true;true
Nueva doctrina penal;1850-9118;;;true;true;true;true;true;true;true;true;true
Nuevamérica;0325-6960;;;true;true;true;true;true;true;true;true;true
Nuevo Itinerario;1850-3578;;;true;true;true;true;true;true;true;true;true
Nuevo mundo;0327-7097;;;true;true;true;true;true;true;true;true;true
OMNIA.;;2618-4699;Universidad Católica de Salta;true;false;true;false;false;false;false;false;false
ORBIS TERTIUS;1851-7811;;UNIV NAC LA PLATA, FAC HUMANIDADES & CIENCIAS EDUC , CALLE 48 E-6 & 7,PISO 5, OF 517, LA PLATA, ARGENTINA, BUENOS AIRES, 1900;true;true;true;true;true;true;true;true;true
Observatorio latinoamericano;;1853-2713;Universidad de Buenos Aires, Facultad de Ciencias Sociales, Instituto de Estudios de América Latina y el Caribe;false;false;true;false;false;false;false;false;false
Obstetricia y ginecología latinoamericanas;0029-7836;;;true;true;true;true;true;true;true;true;true
Octante;2525-0914;;;true;true;true;true;true;true;true;true;true
Odisea (Ciudad Autónoma de Buenos Aires);2408-445X;;;true;true;true;true;true;true;true;true;true
Oficios terrestres;1853-3248;;;true;true;true;true;true;true;true;true;true
Oido Pensante;2250-7116;;Centro Argentino de Informacion Cientifica y Tecnologica (CAICYT-CONICET);true;true;true;true;true;true;true;true;true
Olivar (La Plata);1852-4478;;;true;true;true;true;true;true;true;true;true
Olivar: revista de literatura y cultura españolas;1515-1115;;;true;true;true;true;true;true;true;true;true
Opera lilloana;0078-5245;;;true;true;true;true;true;true;true;true;true
Orientación y sociedad;1851-8893;;;true;true;true;true;true;true;true;true;true
Otra economía;;1851-4715;Universidad Nacional General Sarmiento;false;false;true;false;false;false;false;false;false
PROBIOTA SERIE DOCUMENTOS;1666-7328;1666-731X;PROBIOTA , MUSEO DE LA PLATA , DIV ZOOLOGIA VERTEBRADOS, BUENOS AIRES, ARGENTINA, 000000;false;false;false;false;false;false;true;false;false
PROBIOTA SERIE TECNICA Y DIDACTICA;1667-3204;;PROBIOTA , MUSEO DE LA PLATA , DIV ZOOLOGIA VERTEBRADOS, BUENOS AIRES, ARGENTINA, 000000;true;true;true;true;true;true;true;true;true
PSIENCIA: Revista Latinoamericana de Ciencia Psicológica;1851-9083;;;true;true;true;true;true;true;true;true;true
Palabra clave (La Plata);1853-9912;;;true;true;true;true;true;true;true;true;true
Palermo Business Review;0328-5715;;;true;true;true;true;true;true;true;true;true
Pampa (Santa Fe);2314-0208;;;true;true;true;true;true;true;true;true;true
Pampa: Revista Interuniversitaria de Estudios Territoriales;1669-3299;;;true;true;true;true;true;true;true;true;true
Papeles de trabajo – Centro de Estudios Interdisciplinarios en Etnolingüística Socio-Cultural;0327-6147;1852-4508;;true;false;true;false;false;true;false;false;false
Papeles de trabajo: La revista electrónica del IDAES;1851-2577;;;true;true;true;true;true;true;true;true;true
Papeles del Centro de Investigaciones de la Facultad de Ciencias Jurídicas y Sociales;;2591-2852;Editorial UNL;false;true;true;false;false;false;false;false;false
Papeles: Revista del Centro de Investigaciones de la Facultad de Ciencias Jurídicas y Sociales de la Universidad Nacional del Litoral;1853-2845;;;true;true;true;true;true;true;true;true;true
Papers in Physics;1852-4249;;Instituto de Fisica de Liquidos y Sistemas Biologicos;true;true;true;true;true;true;true;true;true
Paraguay desde las ciencias sociales;2314-1638;;;true;true;true;true;true;true;true;true;true
Pasado abierto;;2451-6961;Universidad Nacional de Mar del Plata;true;true;true;false;false;false;false;false;false
Pathos.;;2313-9390;Universidad Nacional de Córdoba;false;false;true;false;false;false;false;false;false
Patristica et Mediævalia;2683-9636;;;true;true;true;true;true;true;true;true;true
Pensum (Córdoba);;2469-0724;Facultad de Arquitectura, Urbanismo y Diseño Universidad Nacional de Córdoba;true;true;true;false;false;false;false;false;false
Persona: revista iberoamericana de personalismo comunitario;1851-4693;;;true;true;true;true;true;true;true;true;true
Perspectivas de las ciencias económicas y jurídicas;2250-4087;2545-8566;Universidad Nacional de la Pampa, Facultad de Ciencias Económicas y Jurídicas;true;true;true;false;false;false;false;false;false
Perspectivas en psicología;1668-7175;1853-8800;;true;false;false;true;false;false;false;false;false
Perspectivas: revista de ciencias sociales;2525-1112;;;true;true;true;true;true;true;true;true;true
Pescadora de Perlas;2953-5093;2953-4410;;false;true;false;false;false;false;false;false;false
Philosophia: anuario de Filosofía;0328-9672;;;true;true;true;true;true;true;true;true;true
Physiological mini-reviews;;1669-5410;Sociedad Argentina de Fisiología. Centro de Investigaciones Cardiovasculares. Facultad de Medicina. Universidad Nacional de La Plata.;false;false;true;false;false;false;false;false;false
Physis. Secciones A, B y C;0326-1441;;;true;true;true;true;true;true;true;true;true
Phyton;0031-9457;;;true;true;true;true;true;true;true;true;true
Pilquen - Sección Agronomía;1851-2852;;;true;true;true;true;true;true;true;true;true
Pilquen - Sección Psicopedagogía;1851-3115;;;true;true;true;true;true;true;true;true;true
Pirqas.;;2684-0332;Instituto Superior de Formación Docente y Técnica 9-003 "Normal Superior";false;false;true;false;false;false;false;false;false
Plaza Pública: Revista de Trabajo Social;;1852-2459;Universidad Nacional del Centro de la Provincia de Buenos Aires, Facultad de Ciencias Humanas. Carrera de Trabajo Social;false;true;false;false;false;false;false;false;false
Plurentes: Artes y Letras;1853-6212;;;true;true;true;true;true;true;true;true;true
Población de Buenos Aires;;2953-3538;Gobierno de la Ciudad de Buenos Aires;false;false;true;true;false;false;false;false;false
Población y sociedad;0328-3445;1852-8562;Instituto Superior de Estudios Sociales;true;true;true;true;true;true;false;false;false
PolHis: Boletín Bibliográfico Electrónico;1853-7723;;;true;true;true;true;true;true;true;true;true
Polifonías;2314-0488;2314-0496;;true;false;false;false;false;false;false;false;false
Politikós: estudios políticos e internacionales;1668-0707;;;true;true;true;true;true;true;true;true;true
Política y Comunicación: Revista científico académica sobre comunicación política;2953-3821;;;true;true;true;true;true;true;true;true;true
Políticas de la memoria;2683-7234;;;true;true;true;true;true;true;true;true;true
Posdata (Buenos Aires);1851-9601;;;true;true;true;true;true;true;true;true;true
Praxis educativa (Santa Rosa);0328-9702;;;true;true;true;true;true;true;true;true;true
Prismas: revista de historia intelectual;1852-0499;;;true;true;true;true;true;true;true;true;true
Prohistoria: historia, políticas de la historia;1851-9504;;;true;true;true;true;true;true;true;true;true
Prometeica;1852-9488;;;true;true;true;true;true;true;true;true;true
Prometeo conocimiento científico;2953-4275;;;true;true;true;true;true;true;true;true;true
Propuesta educativa (Buenos Aires);0327-4829;1995-7785;;true;false;false;true;false;true;false;false;false
Proyecciones.;;1853-6352;Facultad Regional Buenos Aires, Universidad Tecnológica Nacional;false;false;true;false;false;false;false;false;false
Proyecciones: (La Plata);2618-5474;;;true;true;true;true;true;true;true;true;true
Proyección;;1852-0006;Instituto de Cartografía, Investigación y Formación para el Ordenamiento Territorial;false;true;true;false;false;false;false;false;false
Prudentia iuris;0326-2774;;;true;true;true;true;true;true;true;true;true
Prudentia iuris;2524-9525;;;true;true;true;true;true;true;true;true;true
Práctica arqueológica: revista de la Asociación de Arqueólogos Profesionales de la República Argentina;2618-2874;;;true;true;true;true;true;true;true;true;true
Prácticas de oficio;1851-6076;;;true;true;true;true;true;true;true;true;true
Psi-comunicación: Revista de la Sociedad Española de Parapsicología;2478-2645;;;true;true;true;true;true;true;true;true;true
Psico logos: Revista de psicología;0328-5324;;;true;true;true;true;true;true;true;true;true
Psicoanálisis en la universidad.;;2683-9938;Universidad Nacional de Rosario. Facultad de Psicología. Departamento de Psicoanálisis;false;false;true;false;false;false;false;false;false
Psicodebate. Psicología, Cultura y Sociedad;1515-2251;;;true;true;true;true;true;true;true;true;true
Psicología sin fronteras: revista electrónica de intervención psicosocial y psicología comunitaria;1851-3441;;;true;true;true;true;true;true;true;true;true
Psiencia. Revista latinoamericana de ciencia psicológica;2250-5490;2250-5504;;true;false;false;true;false;false;false;false;false
Psocial (Ciudad Autónoma de Buenos Aires);2422-619X;;;true;true;true;true;true;true;true;true;true
Publicaciones de extensión cultural y didáctica;0325-1853;;;true;true;true;true;true;true;true;true;true
Publicaciones de la Asociación Argentina de Humanidades Digitales (PublicAAHD);2718-7470;;;true;true;true;true;true;true;true;true;true
Publicación - Instituto Antártico Argentino;0521-520X;;;true;true;true;true;true;true;true;true;true
Publicación electrónica de la Asociación Paleontológica Argentina;2469-0228;;;true;true;true;true;true;true;true;true;true
Publicación especial - Centro Panamericano de Zoonosis;0325-1640;;;true;true;true;true;true;true;true;true;true
Publicar en antropología y ciencias sociales (En línea);;2250-7671;Colegio de Graduados en Antropología de la República Argentina;true;false;true;false;false;false;false;false;false
Publicar: En Antropología y Ciencias Sociales;0327-6627;;;true;true;true;true;true;true;true;true;true
Puertas abiertas: Revista de la Escuela de Lenguas;1853-614X;;;true;true;true;true;true;true;true;true;true
Punto Sur.;;2683-7404;Instituto de Geografía Romualdo Ardissone. Facultad de Filosofía y Letras. Universidad de Buenos Aires;false;true;true;false;false;false;false;false;false
Pymes, Innovación y Desarrollo;2344-9195;;;true;true;true;true;true;true;true;true;true
Páginas Revista Digital de la Escuela de Historia de la Facultad de Humanidades y Artes, Universidad Nacional de Rosario;1851-992X;;;true;true;true;true;true;true;true;true;true
Páginas de filosofía;1853-7960;;;true;true;true;true;true;true;true;true;true
Párrafos geográficos.;;1853-9424;IGEOPAT;true;true;true;false;false;false;false;false;false
Quid 16: Revista del Área de Estudios Urbanos;2250-4060;;;true;true;true;true;true;true;true;true;true
Quinto sol;1851-2879;;;true;true;true;true;true;true;true;true;true
Quintú Quimün: revista de lingüística;2591-541X;;;true;true;true;true;true;true;true;true;true
Quirón;0326-2345;;;true;true;true;true;true;true;true;true;true
Química viva;;1666-7948;;true;false;false;true;false;false;false;false;false
RASAL Lingüística;2250-7353;;;true;true;true;true;true;true;true;true;true
RASAL lingüística;2618-3455;;;true;true;true;true;true;true;true;true;true
RECIAL: Revista del Centro de Investigaciones de la Facultad de Filosofía y Humanidades, Áreas Letras;1853-4112;;;true;true;true;true;true;true;true;true;true
RELAPAE: Revista Latinoamericana de Políticas y Administración de la Educación.;2408-4573;;;true;true;true;true;true;true;true;true;true
RESEÑAS de Enseñanza de la Historia;2796-9304;;;true;true;true;true;true;true;true;true;true
REVISTA ARGENTINA DE HISTORIOGRAFIA LINGUISTICA;1852-1495;;REVISTA ARGENTINA HISTORIOGRAFIA LINGUISTICA-RAHL , CIUDAD DE LA PAZ 562 PB D, BUENOS AIRES, ARGENTINA, 1426;true;true;true;true;true;true;true;true;true
REVISTA ELECTRONICA DE FUENTES Y ARCHIVOS;1853-4503;;CENTRO DE ESTUDIOS HISTORICOS PROF CARLOS S A SEGRETI , CANONIGO M CORRO 308, CORDOBA, ARGENTINA, 00000;true;true;true;true;true;true;true;true;true
REVISTA FAVE CIENCIAS VETERINARIAS;1666-938X;;UNIV NAC LITORAL , CIUDAD UNIV, FAC BIOQUIM & CIENC BIOL, PARAJE POZO, SANTA FE, ARGENTINA, 53000;true;true;true;true;true;true;true;true;true
REVISTA IBEROAMERICANA DE DIAGNOSTICO Y EVALUACION-E AVALIACAO PSICOLOGICA;2183-6051;;AIDEP , MARIO BRAVO 427 1 C, CAPITAL FEDERAL, BUENOS AIRES, ARGENTINA, C175ASM CPA;true;true;true;true;true;true;true;true;true
RIN: Revista Internacional del Notariado;0325-1683;;;true;true;true;true;true;true;true;true;true
Raigal: revista interdisciplinaria de Ciencias Sociales;2469-1216;;;true;true;true;true;true;true;true;true;true
Rapallo. Poemas y ensayos;2618-2068;;;true;true;true;true;true;true;true;true;true
Ratio Iuris;;2347-0151;Editorial de la Universidad de Ciencias Empresariales y Sociales (EditUCES);false;false;true;false;false;false;false;false;false
Razón y revolución: teoría, historia, política;1515-1913;;;true;true;true;true;true;true;true;true;true
Realidad económica (Buenos Aires);0325-1926;;;true;true;true;true;true;true;true;true;true
Realidad económica.;;2618-1711;Instituto Argentino para el Desarrollo Económico (IADE);true;false;true;false;false;false;false;false;false
Realidad, Tendencias y Desafíos en Turismo;2545-6199;;;true;true;true;true;true;true;true;true;true
Recial (En línea);;2718-658X;Facultad de Filosofía y Humanidades, Universidad Nacional de Córdoba;true;false;true;false;false;true;false;false;false
Redes de Extensión;2451-7348;;;true;true;true;true;true;true;true;true;true
Redes: Revista de estudios sociales de la ciencia y la tecnología;0328-3186;;;true;true;true;true;true;true;true;true;true
Registros;;2250-8112;Universidad Nacional de Mar del Plata, Facultad de Arquitectura, Urbanismo y Diseño;false;true;true;false;false;false;false;false;false
Relaciones Internacionales;2314-2766;;;true;true;true;true;true;true;true;true;true
Relaciones de la Sociedad Argentina de Antropología;0325-2221;1852-1479;;true;true;true;false;false;true;true;false;false
República y derecho (Mendoza);;2525-1937;Facultad de Derecho, Universidad Nacional de Cuyo;true;false;true;false;false;false;false;false;false
Res gesta;0325-772X;;;true;true;true;true;true;true;true;true;true
Reseñas CeLeHis;;2362-5031;Centro de Letras Hispanoamericanas, Facultad de Humanidades, Universidad Nacional de Mar del Plata;false;false;true;false;false;false;false;false;false
Respirar;;2953-3414;Asociación Latinoamerica de Tórax (ALAT);false;true;true;false;false;false;false;false;false
RevCom: Revista científica de la Red de Carreras de Comunicación Social;2451-7836;;;true;true;true;true;true;true;true;true;true
RevIISE: Revista de Ciencias Sociales y Humanas;2250-5555;;;true;true;true;true;true;true;true;true;true
Revista ADENAG: revista de la Asociación de docentes de Administración General de la República Argentina ( ADENAG );1853-7367;;;true;true;true;true;true;true;true;true;true
Revista Argentina de Antropología Biológica;1853-6387;;;true;true;true;true;true;true;true;true;true
Revista Argentina de Cardiologia;0034-7000;;Sociedad Argentina De Cardiologia;true;true;true;true;true;true;true;true;true
Revista Argentina de Cardiología;1850-3748;;;true;true;true;true;true;true;true;true;true
Revista Argentina de Economía Internacional;2344-9322;;;true;true;true;true;true;true;true;true;true
Revista Argentina de Educación Superior: RAES;1852-8171;;;true;true;true;true;true;true;true;true;true
Revista Argentina de Estudios de Juventud;1852-4907;;;true;true;true;true;true;true;true;true;true
Revista Argentina de Investigación Educativa;2796-7433;;;true;true;true;true;true;true;true;true;true
Revista Argentina de Radiología;1852-9992;0048-7619;Sociedad Argentina de Radiología;true;true;false;true;false;false;false;false;false
